{"accent":{"members":[{"accent":"sea","alias":"roast"},{"accent":"iris","alias":"hold"},{"accent":"ember","alias":"design"},{"accent":"rose","alias":"lab"}],"scope_kind":"all","token":"harbor"},"anchors":["chip:scope","chip:asof","chip:writes","chip:tab-overview","chip:tab-ledger","chip:tab-intercompany","chip:tab-activity","chip:tab-system","chip:tab-classify","row:org=roast","row:org=hold","row:org=design","row:org=lab","cell:org=roast/org","cell:org=roast/parity_year","cell:org=roast/parity_history","cell:org=hold/org","cell:org=hold/parity_year","cell:org=hold/parity_history","cell:org=design/org","cell:org=design/parity_year","cell:org=design/parity_history","cell:org=lab/org","cell:org=lab/parity_year","cell:org=lab/parity_history"],"as_of":"2025-12-31","band":null,"basis":"year","breadcrumb":["Overview"],"build":null,"busy":"in the scope picker","canonical":{"agent":{"acted":false,"connected":false,"last_seen":0,"log":[],"notice":null,"skipped_pending":false,"undo":null,"writes":[]},"config":{"account_map":"cb3389a21a0abeaa","groups":[["all-co",["roast","hold","design","lab"]],["ops",["roast","design","lab"]]],"hash":"6400bdea32dd2c87","orgs":[["roast","c0ffee00-0000-4000-8000-0000000000a1"],["hold","b01d0000-0000-4000-8000-0000000000b2"],["design","de519000-0000-4000-8000-0000000000c3"],["lab","1ab00000-0000-4000-8000-0000000000d4"]]},"env":{"cli":"/usr/local/bin/ownpurse","cli_shown":"~/.local/bin/ownpurse","cli_version":"0.9.0","drift":null,"label":null,"model_now":1791193560,"now":1791193560,"offline":false,"paths":{"cwd":"/w","home":null},"profile":"demo","update_available":null,"version_label":"0.0.0-test"},"keymap":{"bindings":[],"file":"","hash":"","unbind":[],"v":0},"manifest_rev":null,"record":{"chain_seq":274,"classify_rev":82,"derivation":1},"render_epoch":2,"rev":4,"ui":{"activity":{"ep_sel":null,"grouped":false,"sel":null,"top":0},"as_of":"2025-12-31","band":null,"caption":null,"caret":null,"chain":[],"classify":{"audition_set":null,"bulk":null,"catalog":{"base_hash":null,"diff":null,"editor":null,"list":"Projects","sel_project":null,"sel_rule":null,"staged":[],"toast":null},"filter":"","groups":{"doc":null,"focus":"List","member":null,"sel":null},"last_written":null,"mode":"Queue","note":null,"pending_project":false,"picker":null,"selected_anchor":null,"top":0},"cmp":null,"details":false,"differs_only":false,"filter":"","full_history":false,"glossary_focus":null,"history":{"back":[],"forward":[]},"ic":{},"ic_sort":0,"lay_mode":false,"layers":{"layers":[],"next":0},"ledger":{},"manifest":null,"manifest_tab":{"diff":null,"mode":"Entries","prompt":null,"sel":0,"top":0},"narration":null,"note":null,"overlay":{"Picker":{"at":"design","chosen":[],"multi":false,"query":"des","sel":0}},"overview_col":"Org","overview_sel":"roast","overview_top":0,"prompt":null,"recording":null,"result":null,"run":null,"scope":"All","size":[80,24],"system":{"open_pkg":null,"sel":null,"top":0},"tab":"Overview","theme":{"ascii":false,"dark":false,"mode":"Truecolor","paint_bg":false},"theme_overlay":{},"theme_revision":0,"theme_user":null,"via":null,"walk":null,"walk_list":null},"v":1},"caption":null,"classify":{"agent_writes":0,"audition_set":null,"bulk":null,"editor":null,"filter":"","filter_error":null,"jev_enabled":false,"mode":"queue","open":38,"selected_anchor":"design:bt:bt-308:L1","stale":2,"store_rev":82},"clock":{"model_now":"2026-10-05T09:46:00Z","now":"2026-10-05T09:46:00Z"},"compare":null,"data_refreshes":0,"differs_only":false,"drift":null,"filter":"","filter_applies":true,"filter_matches":null,"filter_total":4,"history":{"back":0,"back_to":null,"forward":0,"forward_to":null},"input":{"caret":3,"field":"picker","text":"des"},"keymap":{"overrides":0,"revision":null},"label":null,"lay_mode":false,"layers":[],"level":1,"manifest":null,"mode":"orgs","narration":null,"note":null,"notice":null,"overlay":"picker","palette":null,"profile":"demo","prompt":null,"record":{"chain_seq":274,"classify_rev":82,"derivation":1},"recording":null,"result":null,"rev":4,"rows":[{"anchor":{"org":"roast"},"fields":{"calls_left":"967/1,000","calls_left_estimated":false,"fetched":"07:46 UTC · 2h ago","issues":"none","name":"Tallowmere Coffee Roasting Co.","org":"roast","parity_history":"2 accounts differ","parity_year":"✓ exact","tb_fetched":"2026-10-05 07:46"},"row":1,"selected":true},{"anchor":{"org":"hold"},"fields":{"calls_left":"978/1,000","calls_left_estimated":false,"fetched":"07:46 UTC · 2h ago","issues":"none","name":"Brackenridge Lane Holdings Ltd","org":"hold","parity_history":"✓ exact","parity_year":"✓ exact","tb_fetched":"2026-10-05 07:46"},"row":2,"selected":false},{"anchor":{"org":"design"},"fields":{"calls_left":"938/1,000","calls_left_estimated":false,"fetched":"07:46 UTC · 2h ago","issues":"none","name":"Quillfeather Design Consultancy LLP","org":"design","parity_history":"15 accounts differ","parity_year":"✓ exact","tb_fetched":"2026-10-05 07:46"},"row":3,"selected":false},{"anchor":{"org":"lab"},"fields":{"calls_left":"978/1,000","calls_left_estimated":false,"fetched":"07:46 UTC · 2h ago","issues":"none","name":"Saltmarsh Cupping Lab LLC","org":"lab","parity_history":"✓ exact","parity_year":"✓ exact","tb_fetched":"2026-10-05 07:46"},"row":4,"selected":false}],"running":null,"scope":"all","selected":{"org":"roast"},"selected_label":"Tallowmere Coffee Roasting Co.","size":{"cols":80,"rows":24},"sort":null,"strip":{"calls_left":938,"calls_left_estimated":false,"calls_level":"ok","calls_limit":1000,"matches_xero":null,"record_age":"record 07:46 UTC · 2h ago","record_level":"ok"},"tab":"overview","theme":{"color":"color","glyphs":"unicode","knobs":{"breadcrumb":"0.00","compare_columns":"0.00","header_band":"0.06","header_gradient":false,"pair_band":"neutral","proposed_rows":"0.06","section_band":"0.00","selection":"0.04","status_err":"0.00","status_warn":"0.00"},"name":"ledger-light","overlay":{"tokens":{}},"revision":null},"truncated":false,"update_available":null,"v":1,"version":"0.0.0-test","view":{"first_visible":1,"last_visible":4,"total_rows":4},"walkthrough":null}
