{"accent":{"members":[{"accent":"sea","alias":"roast"}],"scope_kind":"org","token":"iris"},"anchors":["chip:scope","chip:asof","chip:writes","chip:tab-overview","chip:tab-ledger","chip:tab-intercompany","chip:tab-activity","chip:tab-system","chip:tab-classify","chip:tab-manifest","row:code=1010","row:code=1060","row:code=2410","row:code=3010","row:code=3200","row:code=4010","row:code=5020","row:code=6140","row:code=6290","row:code=6310","row:code=6520","row:code=6830"],"as_of":"2025-12-31","band":null,"basis":"year","breadcrumb":["roast","Trial balance at 2025-12-31 (accrual)"],"build":null,"busy":null,"canonical":{"agent":{"acted":false,"connected":false,"last_seen":0,"log":[],"notice":null,"skipped_pending":false,"undo":null,"writes":[]},"config":{"account_map":"cb3389a21a0abeaa","groups":[["all-co",["roast","hold","design","lab"]],["ops",["roast","design","lab"]]],"hash":"6400bdea32dd2c87","orgs":[["roast","c0ffee00-0000-4000-8000-0000000000a1"],["hold","b01d0000-0000-4000-8000-0000000000b2"],["design","de519000-0000-4000-8000-0000000000c3"],["lab","1ab00000-0000-4000-8000-0000000000d4"]]},"env":{"cli":"/usr/local/bin/ownpurse","cli_shown":"~/.local/bin/ownpurse","cli_version":"0.9.0","drift":null,"label":null,"model_now":1791193560,"now":1791193560,"offline":false,"paths":{"cwd":"/w","home":null},"profile":"demo","update_available":null,"version_label":"0.0.0-test"},"keymap":{"bindings":[],"file":"","hash":"","unbind":[],"v":0},"manifest_rev":null,"record":{"chain_seq":274,"classify_rev":82,"derivation":1},"render_epoch":1,"rev":3,"ui":{"activity":{"ep_sel":null,"grouped":false,"sel":null,"top":0},"as_of":"2025-12-31","band":null,"caption":null,"caret":null,"chain":[],"classify":{"audition_set":null,"bulk":null,"catalog":{"base_hash":null,"diff":null,"editor":null,"list":"Projects","sel_project":null,"sel_rule":null,"staged":[],"toast":null},"filter":"","groups":{"doc":null,"focus":"List","member":null,"sel":null},"last_written":null,"mode":"Queue","note":null,"pending_project":false,"picker":null,"selected_anchor":null,"top":0},"cmp":null,"details":true,"differs_only":false,"filter":"","full_history":false,"glossary_focus":null,"history":{"back":[{"activity":{"ep_sel":null,"grouped":false,"sel":null,"top":0},"as_of":"2025-12-31","chain":[],"classify":{"audition_set":null,"bulk":null,"catalog":{"base_hash":null,"diff":null,"editor":null,"list":"Projects","sel_project":null,"sel_rule":null,"staged":[],"toast":null},"filter":"","groups":{"doc":null,"focus":"List","member":null,"sel":null},"last_written":null,"mode":"Queue","note":null,"pending_project":false,"picker":null,"selected_anchor":null,"top":0},"cmp":null,"differs_only":false,"filter":"","full_history":false,"ic":{},"ic_sort":0,"ledger":{},"overview_col":"Org","overview_sel":"roast","overview_top":0,"scope":"All","system":{"open_pkg":null,"sel":null,"top":0},"tab":"Overview","via":null},{"activity":{"ep_sel":null,"grouped":false,"sel":null,"top":0},"as_of":"2025-12-31","chain":[],"classify":{"audition_set":null,"bulk":null,"catalog":{"base_hash":null,"diff":null,"editor":null,"list":"Projects","sel_project":null,"sel_rule":null,"staged":[],"toast":null},"filter":"","groups":{"doc":null,"focus":"List","member":null,"sel":null},"last_written":null,"mode":"Queue","note":null,"pending_project":false,"picker":null,"selected_anchor":null,"top":0},"cmp":null,"differs_only":false,"filter":"","full_history":false,"ic":{},"ic_sort":0,"ledger":{},"overview_col":"Org","overview_sel":"roast","overview_top":0,"scope":"All","system":{"open_pkg":null,"sel":null,"top":0},"tab":"Ledger","via":null}],"forward":[]},"ic":{},"ic_sort":0,"lay_mode":false,"layers":{"layers":[],"next":0},"ledger":{},"manifest":null,"manifest_tab":{"diff":null,"mode":"Entries","prompt":null,"sel":0,"top":0},"narration":null,"note":null,"overlay":null,"overview_col":"Org","overview_sel":"roast","overview_top":0,"prompt":null,"recording":null,"result":null,"run":null,"scope":{"Org":"roast"},"size":[100,30],"system":{"open_pkg":null,"sel":null,"top":0},"tab":"Ledger","theme":{"ascii":false,"dark":true,"mode":"Truecolor","paint_bg":false},"theme_overlay":{"accent":"iris","knob.section_band":"0.04"},"theme_revision":1,"theme_user":null,"via":null,"walk":null,"walk_list":null},"v":1},"caption":null,"classify":{"agent_writes":0,"audition_set":null,"bulk":null,"editor":null,"filter":"","filter_error":null,"jev_enabled":false,"mode":"queue","open":38,"selected_anchor":"roast:bt:bt-110:L1","stale":2,"store_rev":82},"clock":{"model_now":"2026-10-05T09:46:00Z","now":"2026-10-05T09:46:00Z"},"compare":null,"data_refreshes":0,"differs_only":false,"drift":null,"filter":"","filter_applies":true,"filter_matches":null,"filter_total":12,"history":{"back":2,"back_to":"Ledger › all","forward":0,"forward_to":null},"input":null,"keymap":{"overrides":0,"revision":null},"label":null,"lay_mode":false,"layers":[],"level":1,"manifest":null,"mode":"trial balance","narration":null,"note":null,"notice":null,"overlay":null,"palette":null,"profile":"demo","prompt":null,"record":{"chain_seq":274,"classify_rev":82,"derivation":1},"recording":null,"result":null,"rev":3,"rows":[{"anchor":{"account_code":"1010","account_id":"r-op","org":"roast"},"fields":{"account":"Tallowmere Roastery Operating Account","balance":"41671.82","balance_value":41671.82,"class":"ASSET","code":"1010","credit":"","credit_value":null,"debit":"41,671.82","debit_value":41671.82,"differs":false,"flag":""},"row":1,"selected":true},{"anchor":{"account_code":"1060","account_id":"r-card","org":"roast"},"fields":{"account":"Tallowmere Green-Bean Card","balance":"-1990.90","balance_value":-1990.90,"class":"ASSET","code":"1060","credit":"1,990.90","credit_value":1990.90,"debit":"","debit_value":null,"differs":false,"flag":""},"row":2,"selected":false},{"anchor":{"account_code":"2410","account_id":"r-2410","org":"roast"},"fields":{"account":"Brackenridge Term Loan","balance":"-15568.80","balance_value":-15568.80,"class":"LIABILITY","code":"2410","credit":"15,568.80","credit_value":15568.80,"debit":"","debit_value":null,"differs":false,"flag":""},"row":3,"selected":false},{"anchor":{"account_code":"3010","account_id":"r-3010","org":"roast"},"fields":{"account":"Tallowmere Paid-In Capital","balance":"-4618.27","balance_value":-4618.27,"class":"EQUITY","code":"3010","credit":"4,618.27","credit_value":4618.27,"debit":"","debit_value":null,"differs":false,"flag":""},"row":4,"selected":false},{"anchor":{"account_code":"3200","account_id":"r-3200","org":"roast"},"fields":{"account":"Retained Earnings","balance":"-7316.42","balance_value":-7316.42,"class":"EQUITY","code":"3200","credit":"7,316.42","credit_value":7316.42,"debit":"","debit_value":null,"differs":false,"flag":""},"row":5,"selected":false},{"anchor":{"account_code":"4010","account_id":"r-4010","org":"roast"},"fields":{"account":"Wholesale Bean Sales","balance":"-20391.63","balance_value":-20391.63,"class":"REVENUE","code":"4010","credit":"20,391.63","credit_value":20391.63,"debit":"","debit_value":null,"differs":false,"flag":""},"row":6,"selected":false},{"anchor":{"account_code":"5020","account_id":"r-5020","org":"roast"},"fields":{"account":"Green Coffee Purchases","balance":"5369.15","balance_value":5369.15,"class":"EXPENSE","code":"5020","credit":"","credit_value":null,"debit":"5,369.15","debit_value":5369.15,"differs":false,"flag":""},"row":7,"selected":false},{"anchor":{"account_code":"6140","account_id":"r-6140","org":"roast"},"fields":{"account":"Roaster Afterburner Servicing","balance":"898.06","balance_value":898.06,"class":"EXPENSE","code":"6140","credit":"","credit_value":null,"debit":"898.06","debit_value":898.06,"differs":false,"flag":""},"row":8,"selected":false},{"anchor":{"account_code":"6290","account_id":"r-6290","org":"roast"},"fields":{"account":"Bag Artwork & Proofs","balance":"1148.63","balance_value":1148.63,"class":"EXPENSE","code":"6290","credit":"","credit_value":null,"debit":"1,148.63","debit_value":1148.63,"differs":false,"flag":""},"row":9,"selected":false},{"anchor":{"account_code":"6310","account_id":"r-6310","org":"roast"},"fields":{"account":"Cupping Room Supplies","balance":"147.38","balance_value":147.38,"class":"EXPENSE","code":"6310","credit":"","credit_value":null,"debit":"147.38","debit_value":147.38,"differs":false,"flag":""},"row":10,"selected":false},{"anchor":{"account_code":"6520","account_id":"r-6520","org":"roast"},"fields":{"account":"Delivery Van Fuel","balance":"238.61","balance_value":238.61,"class":"EXPENSE","code":"6520","credit":"","credit_value":null,"debit":"238.61","debit_value":238.61,"differs":false,"flag":""},"row":11,"selected":false},{"anchor":{"account_code":"6830","account_id":"r-6830","org":"roast"},"fields":{"account":"Term Loan Interest","balance":"412.37","balance_value":412.37,"class":"EXPENSE","code":"6830","credit":"","credit_value":null,"debit":"412.37","debit_value":412.37,"differs":false,"flag":""},"row":12,"selected":false}],"running":null,"scope":"roast","selected":{"account_code":"1010","account_id":"r-op","org":"roast"},"selected_label":"1010 Tallowmere Roastery Operating Account","size":{"cols":100,"rows":30},"sort":null,"strip":{"calls_left":967,"calls_left_estimated":false,"calls_level":"ok","calls_limit":1000,"matches_xero":true,"record_age":"record 07:46 UTC · 2h ago","record_level":"ok"},"tab":"ledger","theme":{"color":"color","glyphs":"unicode","knobs":{"breadcrumb":"0.00","compare_columns":"0.00","header_band":"0.10","header_gradient":false,"pair_band":"neutral","proposed_rows":"0.06","section_band":"0.04","selection":"0.04","status_err":"0.00","status_warn":"0.00"},"name":"ledger-dark","overlay":{"tokens":{"accent":"iris","knob.section_band":"0.04"}},"revision":"1"},"truncated":false,"update_available":null,"v":1,"version":"0.0.0-test","view":{"first_visible":1,"last_visible":12,"total_rows":12},"walkthrough":null}
