{"accent":{"members":[{"accent":"ember","alias":"design"},{"accent":"sea","alias":"roast"}],"scope_kind":"pair","token":"harbor"},"anchors":["chip:scope","chip:asof","chip:writes","chip:tab-overview","chip:tab-ledger","chip:tab-intercompany","chip:tab-activity","chip:tab-system","chip:tab-classify","chip:tab-manifest"],"as_of":"2025-12-31","band":null,"basis":"year","breadcrumb":["Quillfeather ↔ Tallowmere (recharges)","bridge at 2025-12-31"],"build":null,"busy":null,"canonical":{"agent":{"acted":false,"connected":false,"last_seen":0,"log":[],"notice":null,"skipped_pending":false,"undo":null,"writes":[]},"config":{"account_map":"cb3389a21a0abeaa","groups":[["all-co",["roast","hold","design","lab"]],["ops",["roast","design","lab"]]],"hash":"6400bdea32dd2c87","orgs":[["roast","c0ffee00-0000-4000-8000-0000000000a1"],["hold","b01d0000-0000-4000-8000-0000000000b2"],["design","de519000-0000-4000-8000-0000000000c3"],["lab","1ab00000-0000-4000-8000-0000000000d4"]]},"env":{"cli":"/usr/local/bin/ownpurse","cli_shown":"~/.local/bin/ownpurse","cli_version":"0.9.0","drift":null,"label":null,"model_now":1791193560,"now":1791193560,"offline":false,"paths":{"cwd":"/w","home":null},"profile":"demo","update_available":null,"version_label":"0.0.0-test"},"keymap":{"bindings":[],"file":"","hash":"","unbind":[],"v":0},"manifest_rev":null,"record":{"chain_seq":274,"classify_rev":82,"derivation":1},"render_epoch":2,"rev":2,"ui":{"activity":{"ep_sel":null,"grouped":false,"sel":null,"top":0},"as_of":"2025-12-31","band":null,"caption":null,"caret":null,"chain":[],"classify":{"audition_set":null,"bulk":null,"catalog":{"base_hash":null,"diff":null,"editor":null,"list":"Projects","sel_project":null,"sel_rule":null,"staged":[],"toast":null},"filter":"","groups":{"doc":null,"focus":"List","member":null,"sel":null},"last_written":null,"mode":"Queue","note":null,"pending_project":false,"picker":null,"selected_anchor":null,"top":0},"cmp":null,"details":false,"differs_only":false,"filter":"","full_history":false,"glossary_focus":null,"history":{"back":[{"activity":{"ep_sel":null,"grouped":false,"sel":null,"top":0},"as_of":"2025-12-31","chain":[],"classify":{"audition_set":null,"bulk":null,"catalog":{"base_hash":null,"diff":null,"editor":null,"list":"Projects","sel_project":null,"sel_rule":null,"staged":[],"toast":null},"filter":"","groups":{"doc":null,"focus":"List","member":null,"sel":null},"last_written":null,"mode":"Queue","note":null,"pending_project":false,"picker":null,"selected_anchor":null,"top":0},"cmp":null,"differs_only":false,"filter":"","full_history":false,"ic":{},"ic_sort":0,"ledger":{},"overview_col":"Org","overview_sel":"roast","overview_top":0,"scope":"All","system":{"open_pkg":null,"sel":null,"top":0},"tab":"Overview","via":null},{"activity":{"ep_sel":null,"grouped":false,"sel":null,"top":0},"as_of":"2025-12-31","chain":[],"classify":{"audition_set":null,"bulk":null,"catalog":{"base_hash":null,"diff":null,"editor":null,"list":"Projects","sel_project":null,"sel_rule":null,"staged":[],"toast":null},"filter":"","groups":{"doc":null,"focus":"List","member":null,"sel":null},"last_written":null,"mode":"Queue","note":null,"pending_project":false,"picker":null,"selected_anchor":null,"top":0},"cmp":null,"differs_only":false,"filter":"","full_history":false,"ic":{},"ic_sort":0,"ledger":{},"overview_col":"Org","overview_sel":"roast","overview_top":0,"scope":"All","system":{"open_pkg":null,"sel":null,"top":0},"tab":"Intercompany","via":null}],"forward":[]},"ic":{"all":{"doc":null,"item":null,"item_idx":0,"item_top":0,"l1_idx":0,"l1_top":0,"level":2,"pair":"design-roast"}},"ic_sort":0,"lay_mode":false,"layers":{"layers":[],"next":0},"ledger":{},"manifest":null,"manifest_tab":{"diff":null,"mode":"Entries","prompt":null,"sel":0,"top":0},"narration":null,"note":null,"overlay":null,"overview_col":"Org","overview_sel":"roast","overview_top":0,"prompt":null,"recording":null,"result":null,"run":null,"scope":"All","size":[100,30],"system":{"open_pkg":null,"sel":null,"top":0},"tab":"Intercompany","theme":{"ascii":false,"dark":true,"mode":"Truecolor","paint_bg":false},"theme_overlay":{},"theme_revision":1,"theme_user":["warm","[meta]\nname = \"warm\"\nextends = \"ledger-dark\"\n\n[palette]\nslate.950 = { hex = \"#161412\" }\nslate.900 = { hex = \"#1E1A17\" }\n\n[semantic]\nbg = \"@slate.950\"\n\"surface.top\" = \"@slate.900\"\n\n[component]\n\"section.band.bg\" = \"mix($surface.section, $accent, 0.04)\"\n"],"via":null,"walk":null,"walk_list":null},"v":1},"caption":null,"classify":{"agent_writes":0,"audition_set":null,"bulk":null,"editor":null,"filter":"","filter_error":null,"jev_enabled":false,"mode":"queue","open":38,"selected_anchor":"design:bt:bt-308:L1","stale":2,"store_rev":82},"clock":{"model_now":"2026-10-05T09:46:00Z","now":"2026-10-05T09:46:00Z"},"compare":null,"data_refreshes":0,"differs_only":false,"drift":null,"filter":"","filter_applies":false,"filter_matches":null,"filter_total":null,"history":{"back":2,"back_to":"Intercompany › all","forward":0,"forward_to":null},"input":null,"keymap":{"overrides":0,"revision":null},"label":null,"lay_mode":false,"layers":[],"level":2,"manifest":null,"mode":"bridge","narration":null,"note":null,"notice":null,"overlay":null,"palette":null,"profile":"demo","prompt":null,"record":{"chain_seq":274,"classify_rev":82,"derivation":1},"recording":null,"result":null,"rev":2,"rows":[],"running":null,"scope":"all","selected":null,"selected_label":null,"size":{"cols":100,"rows":30},"sort":"status","strip":{"calls_left":938,"calls_left_estimated":false,"calls_level":"ok","calls_limit":1000,"matches_xero":null,"record_age":"record 07:46 UTC · 2h ago","record_level":"ok"},"tab":"intercompany","theme":{"color":"color","glyphs":"unicode","knobs":{"breadcrumb":"0.00","compare_columns":"0.00","header_band":"0.10","header_gradient":false,"pair_band":"neutral","proposed_rows":"0.06","section_band":"0.00","selection":"0.04","status_err":"0.00","status_warn":"0.00"},"name":"warm","overlay":{"tokens":{}},"revision":"1"},"truncated":false,"update_available":null,"v":1,"version":"0.0.0-test","view":{"first_visible":null,"last_visible":null,"total_rows":0},"walkthrough":null}
