{"accent":{"members":[{"accent":"sea","alias":"roast"}],"scope_kind":"org","token":"sea"},"as_of":"2025-12-31","band":null,"basis":"year","breadcrumb":["roast","Trial balance at 2025-12-31 (accrual)"],"build":null,"busy":"typing in the filter","canonical":{"agent":{"acted":false,"connected":false,"last_seen":0,"log":[],"notice":null,"skipped_pending":false,"undo":null,"writes":[]},"config":{"account_map":"cb3389a21a0abeaa","groups":[["all-co",["roast","hold","design","lab"]],["ops",["roast","design","lab"]]],"hash":"6400bdea32dd2c87","orgs":[["roast","c0ffee00-0000-4000-8000-0000000000a1"],["hold","b01d0000-0000-4000-8000-0000000000b2"],["design","de519000-0000-4000-8000-0000000000c3"],["lab","1ab00000-0000-4000-8000-0000000000d4"]]},"env":{"cli":"/usr/local/bin/ownpurse","cli_shown":"~/.local/bin/ownpurse","cli_version":"0.9.0","drift":null,"label":null,"model_now":1791193560,"now":1791193560,"offline":false,"paths":{"cwd":"/w","home":null},"profile":"demo","update_available":null,"version_label":"0.0.0-test"},"keymap":{"bindings":[],"file":"","hash":"","unbind":[],"v":0},"manifest_rev":null,"record":{"chain_seq":274,"classify_rev":82,"derivation":1},"render_epoch":1,"rev":8,"ui":{"activity":{"ep_sel":null,"grouped":false,"sel":null,"top":0},"as_of":"2025-12-31","band":null,"caption":null,"caret":3,"chain":[],"classify":{"audition_set":null,"bulk":null,"catalog":{"base_hash":null,"diff":null,"editor":null,"list":"Projects","sel_project":null,"sel_rule":null,"staged":[],"toast":null},"filter":"","groups":{"doc":null,"focus":"List","member":null,"sel":null},"last_written":null,"mode":"Queue","note":null,"pending_project":false,"picker":null,"selected_anchor":null,"top":0},"cmp":null,"details":false,"differs_only":false,"filter":"Tall","full_history":false,"history":{"back":[{"activity":{"ep_sel":null,"grouped":false,"sel":null,"top":0},"as_of":"2025-12-31","chain":[],"classify":{"audition_set":null,"bulk":null,"catalog":{"base_hash":null,"diff":null,"editor":null,"list":"Projects","sel_project":null,"sel_rule":null,"staged":[],"toast":null},"filter":"","groups":{"doc":null,"focus":"List","member":null,"sel":null},"last_written":null,"mode":"Queue","note":null,"pending_project":false,"picker":null,"selected_anchor":null,"top":0},"cmp":null,"differs_only":false,"filter":"","full_history":false,"ic":{},"ic_sort":0,"ledger":{},"overview_col":"Org","overview_sel":"roast","overview_top":0,"scope":"All","system":{"open_pkg":null,"sel":null,"top":0},"tab":"Overview","via":null},{"activity":{"ep_sel":null,"grouped":false,"sel":null,"top":0},"as_of":"2025-12-31","chain":[],"classify":{"audition_set":null,"bulk":null,"catalog":{"base_hash":null,"diff":null,"editor":null,"list":"Projects","sel_project":null,"sel_rule":null,"staged":[],"toast":null},"filter":"","groups":{"doc":null,"focus":"List","member":null,"sel":null},"last_written":null,"mode":"Queue","note":null,"pending_project":false,"picker":null,"selected_anchor":null,"top":0},"cmp":null,"differs_only":false,"filter":"","full_history":false,"ic":{},"ic_sort":0,"ledger":{},"overview_col":"Org","overview_sel":"roast","overview_top":0,"scope":"All","system":{"open_pkg":null,"sel":null,"top":0},"tab":"Ledger","via":null},{"activity":{"ep_sel":null,"grouped":false,"sel":null,"top":0},"as_of":"2025-12-31","chain":[],"classify":{"audition_set":null,"bulk":null,"catalog":{"base_hash":null,"diff":null,"editor":null,"list":"Projects","sel_project":null,"sel_rule":null,"staged":[],"toast":null},"filter":"","groups":{"doc":null,"focus":"List","member":null,"sel":null},"last_written":null,"mode":"Queue","note":null,"pending_project":false,"picker":null,"selected_anchor":null,"top":0},"cmp":null,"differs_only":false,"filter":"","full_history":false,"ic":{},"ic_sort":0,"ledger":{},"overview_col":"Org","overview_sel":"roast","overview_top":0,"scope":{"Org":"roast"},"system":{"open_pkg":null,"sel":null,"top":0},"tab":"Ledger","via":null},{"activity":{"ep_sel":null,"grouped":false,"sel":null,"top":0},"as_of":"2025-12-31","chain":[],"classify":{"audition_set":null,"bulk":null,"catalog":{"base_hash":null,"diff":null,"editor":null,"list":"Projects","sel_project":null,"sel_rule":null,"staged":[],"toast":null},"filter":"","groups":{"doc":null,"focus":"List","member":null,"sel":null},"last_written":null,"mode":"Queue","note":null,"pending_project":false,"picker":null,"selected_anchor":null,"top":0},"cmp":null,"differs_only":false,"filter":"T","full_history":false,"ic":{},"ic_sort":0,"ledger":{},"overview_col":"Org","overview_sel":"roast","overview_top":0,"scope":{"Org":"roast"},"system":{"open_pkg":null,"sel":null,"top":0},"tab":"Ledger","via":null},{"activity":{"ep_sel":null,"grouped":false,"sel":null,"top":0},"as_of":"2025-12-31","chain":[],"classify":{"audition_set":null,"bulk":null,"catalog":{"base_hash":null,"diff":null,"editor":null,"list":"Projects","sel_project":null,"sel_rule":null,"staged":[],"toast":null},"filter":"","groups":{"doc":null,"focus":"List","member":null,"sel":null},"last_written":null,"mode":"Queue","note":null,"pending_project":false,"picker":null,"selected_anchor":null,"top":0},"cmp":null,"differs_only":false,"filter":"Ta","full_history":false,"ic":{},"ic_sort":0,"ledger":{},"overview_col":"Org","overview_sel":"roast","overview_top":0,"scope":{"Org":"roast"},"system":{"open_pkg":null,"sel":null,"top":0},"tab":"Ledger","via":null},{"activity":{"ep_sel":null,"grouped":false,"sel":null,"top":0},"as_of":"2025-12-31","chain":[],"classify":{"audition_set":null,"bulk":null,"catalog":{"base_hash":null,"diff":null,"editor":null,"list":"Projects","sel_project":null,"sel_rule":null,"staged":[],"toast":null},"filter":"","groups":{"doc":null,"focus":"List","member":null,"sel":null},"last_written":null,"mode":"Queue","note":null,"pending_project":false,"picker":null,"selected_anchor":null,"top":0},"cmp":null,"differs_only":false,"filter":"Tal","full_history":false,"ic":{},"ic_sort":0,"ledger":{},"overview_col":"Org","overview_sel":"roast","overview_top":0,"scope":{"Org":"roast"},"system":{"open_pkg":null,"sel":null,"top":0},"tab":"Ledger","via":null}],"forward":[]},"ic":{},"ic_sort":0,"ledger":{},"manifest":null,"manifest_tab":{"diff":null,"mode":"Entries","prompt":null,"sel":0,"top":0},"note":null,"overlay":null,"overview_col":"Org","overview_sel":"roast","overview_top":0,"prompt":{"Filter":"Tall"},"result":null,"run":null,"scope":{"Org":"roast"},"size":[100,30],"system":{"open_pkg":null,"sel":null,"top":0},"tab":"Ledger","theme":{"ascii":false,"dark":true,"mode":"Truecolor","paint_bg":false},"theme_overlay":{},"theme_revision":0,"theme_user":null,"via":null},"v":1},"caption":null,"classify":{"agent_writes":0,"audition_set":null,"bulk":null,"editor":null,"filter":"","filter_error":null,"jev_enabled":false,"mode":"queue","open":38,"selected_anchor":"roast:bt:bt-110:L1","stale":2,"store_rev":82},"clock":{"model_now":"2026-10-05T09:46:00Z","now":"2026-10-05T09:46:00Z"},"compare":null,"data_refreshes":0,"differs_only":false,"drift":null,"filter":"Tall","filter_applies":true,"filter_matches":3,"filter_total":12,"history":{"back":6,"back_to":"Ledger › roast › filter “Tal”","forward":0,"forward_to":null},"input":{"caret":3,"field":"filter","text":"Tall"},"keymap":{"overrides":0,"revision":null},"label":null,"level":1,"manifest":null,"mode":"trial balance","note":null,"notice":null,"overlay":null,"palette":null,"profile":"demo","prompt":{"kind":"filter","text":"Tall"},"record":{"chain_seq":274,"classify_rev":82,"derivation":1},"result":null,"rev":8,"rows":[{"anchor":{"account_code":"1010","account_id":"r-op","org":"roast"},"fields":{"account":"Tallowmere Roastery Operating Account","balance":"41671.82","balance_value":41671.82,"class":"ASSET","code":"1010","credit":"","credit_value":null,"debit":"41,671.82","debit_value":41671.82,"differs":false,"flag":""},"row":1,"selected":true},{"anchor":{"account_code":"1060","account_id":"r-card","org":"roast"},"fields":{"account":"Tallowmere Green-Bean Card","balance":"-1990.90","balance_value":-1990.90,"class":"ASSET","code":"1060","credit":"1,990.90","credit_value":1990.90,"debit":"","debit_value":null,"differs":false,"flag":""},"row":2,"selected":false},{"anchor":{"account_code":"3010","account_id":"r-3010","org":"roast"},"fields":{"account":"Tallowmere Paid-In Capital","balance":"-4618.27","balance_value":-4618.27,"class":"EQUITY","code":"3010","credit":"4,618.27","credit_value":4618.27,"debit":"","debit_value":null,"differs":false,"flag":""},"row":3,"selected":false}],"running":null,"scope":"roast","selected":{"account_code":"1010","account_id":"r-op","org":"roast"},"selected_label":"1010 Tallowmere Roastery Operating Account","size":{"cols":100,"rows":30},"sort":null,"strip":{"calls_left":967,"calls_left_estimated":false,"calls_level":"ok","calls_limit":1000,"matches_xero":true,"record_age":"record 07:46 UTC · 2h ago","record_level":"ok"},"tab":"ledger","theme":{"color":"color","glyphs":"unicode","knobs":{"breadcrumb":"0.00","compare_columns":"0.00","header_band":"0.10","header_gradient":false,"pair_band":"neutral","proposed_rows":"0.06","section_band":"0.00","selection":"0.04","status_err":"0.00","status_warn":"0.00"},"name":"ledger-dark","overlay":{"tokens":{}},"revision":null},"truncated":false,"update_available":null,"v":1,"version":"0.0.0-test","view":{"first_visible":1,"last_visible":3,"total_rows":3}}
