{"accent":{"members":[{"accent":"iris","alias":"hold"}],"scope_kind":"org","token":"iris"},"anchors":["chip:scope","chip:asof","chip:agent","chip:writes","chip:tab-overview","chip:tab-ledger","chip:tab-intercompany","chip:tab-activity","chip:tab-system","chip:tab-classify","chip:tab-manifest","row:code=1010","row:code=1460","row:code=1470","row:code=1480","row:code=3010","row:code=3200","row:code=4610","row:code=4710","row:code=6050"],"as_of":"2025-12-31","band":null,"basis":"year","breadcrumb":["hold","Trial balance at 2025-12-31 (accrual)"],"build":null,"busy":null,"canonical":{"agent":{"acted":true,"connected":true,"last_seen":1791193560,"log":[{"at":"2026-10-05T09:46:00.000000Z","day_left":null,"endpoint":"send tab=ledger scope=hold caption=Brackenridge fee receivable, 2025 · 3 lines · 4,670.51","hay":"2026-10-05t09:46:00.000000z agent agent send tab=ledger scope=hold caption=brackenridge fee receivable, 2025 · 3 lines · 4,670.51 ok ","id":1099511627776,"method":"agent","min_left":null,"ms":null,"org":"agent","path":"send tab=ledger scope=hold caption=Brackenridge fee receivable, 2025 · 3 lines · 4,670.51","problem":null,"status":null,"tenant":null}],"notice":{"Changed":["opened Ledger","scope hold","caption “Brackenridge fee receivable, 2025 · 3 lines · 4,670.51”"]},"skipped_pending":false,"undo":{"activity":{"ep_sel":null,"grouped":false,"sel":null,"top":0},"as_of":"2025-12-31","chain":[],"classify":{"audition_set":null,"bulk":null,"catalog":{"base_hash":null,"diff":null,"editor":null,"list":"Projects","sel_project":null,"sel_rule":null,"staged":[],"toast":null},"filter":"","groups":{"doc":null,"focus":"List","member":null,"sel":null},"last_written":null,"mode":"Queue","note":null,"pending_project":false,"picker":null,"selected_anchor":null,"top":0},"cmp":null,"differs_only":false,"filter":"","full_history":false,"ic":{},"ic_sort":0,"ledger":{},"overview_col":"Org","overview_sel":"roast","overview_top":0,"scope":"All","system":{"open_pkg":null,"sel":null,"top":0},"tab":"Overview","via":null},"writes":[]},"config":{"account_map":"cb3389a21a0abeaa","groups":[["all-co",["roast","hold","design","lab"]],["ops",["roast","design","lab"]]],"hash":"6400bdea32dd2c87","orgs":[["roast","c0ffee00-0000-4000-8000-0000000000a1"],["hold","b01d0000-0000-4000-8000-0000000000b2"],["design","de519000-0000-4000-8000-0000000000c3"],["lab","1ab00000-0000-4000-8000-0000000000d4"]]},"env":{"cli":"/usr/local/bin/ownpurse","cli_shown":"~/.local/bin/ownpurse","cli_version":"0.9.0","drift":null,"label":null,"model_now":1791193560,"now":1791193560,"offline":false,"paths":{"cwd":"/w","home":null},"profile":"demo","update_available":null,"version_label":"0.0.0-test"},"keymap":{"bindings":[],"file":"","hash":"","unbind":[],"v":0},"manifest_rev":null,"record":{"chain_seq":274,"classify_rev":82,"derivation":1},"render_epoch":1,"rev":1,"ui":{"activity":{"ep_sel":null,"grouped":false,"sel":58,"top":0},"as_of":"2025-12-31","band":null,"caption":{"by":"agent","rev":1,"text":"Brackenridge fee receivable, 2025 · 3 lines · 4,670.51"},"caret":null,"chain":[],"classify":{"audition_set":null,"bulk":null,"catalog":{"base_hash":null,"diff":null,"editor":null,"list":"Projects","sel_project":null,"sel_rule":null,"staged":[],"toast":null},"filter":"","groups":{"doc":null,"focus":"List","member":null,"sel":null},"last_written":null,"mode":"Queue","note":null,"pending_project":false,"picker":null,"selected_anchor":null,"top":0},"cmp":null,"details":false,"differs_only":false,"filter":"","full_history":false,"glossary_focus":null,"history":{"back":[{"activity":{"ep_sel":null,"grouped":false,"sel":null,"top":0},"as_of":"2025-12-31","chain":[],"classify":{"audition_set":null,"bulk":null,"catalog":{"base_hash":null,"diff":null,"editor":null,"list":"Projects","sel_project":null,"sel_rule":null,"staged":[],"toast":null},"filter":"","groups":{"doc":null,"focus":"List","member":null,"sel":null},"last_written":null,"mode":"Queue","note":null,"pending_project":false,"picker":null,"selected_anchor":null,"top":0},"cmp":null,"differs_only":false,"filter":"","full_history":false,"ic":{},"ic_sort":0,"ledger":{},"overview_col":"Org","overview_sel":"roast","overview_top":0,"scope":"All","system":{"open_pkg":null,"sel":null,"top":0},"tab":"Overview","via":null}],"forward":[]},"ic":{},"ic_sort":0,"lay_mode":false,"layers":{"layers":[],"next":0},"ledger":{},"manifest":null,"manifest_tab":{"diff":null,"mode":"Entries","prompt":null,"sel":0,"top":0},"narration":null,"note":null,"overlay":null,"overview_col":"Org","overview_sel":"roast","overview_top":0,"prompt":null,"recording":null,"result":null,"run":null,"scope":{"Org":"hold"},"size":[100,30],"system":{"open_pkg":null,"sel":null,"top":0},"tab":"Ledger","theme":{"ascii":false,"dark":false,"mode":"Truecolor","paint_bg":false},"theme_overlay":{},"theme_revision":0,"theme_user":null,"via":null,"walk":null,"walk_list":null},"v":1},"caption":{"by":"agent","rev":1,"text":"Brackenridge fee receivable, 2025 · 3 lines · 4,670.51"},"classify":{"agent_writes":0,"audition_set":null,"bulk":null,"editor":null,"filter":"","filter_error":null,"jev_enabled":false,"mode":"queue","open":38,"selected_anchor":"hold:bt:bt-201:L1","stale":2,"store_rev":82},"clock":{"model_now":"2026-10-05T09:46:00Z","now":"2026-10-05T09:46:00Z"},"compare":null,"data_refreshes":0,"differs_only":false,"drift":null,"filter":"","filter_applies":true,"filter_matches":null,"filter_total":9,"history":{"back":1,"back_to":"Overview › all","forward":0,"forward_to":null},"input":null,"keymap":{"overrides":0,"revision":null},"label":null,"lay_mode":false,"layers":[],"level":1,"manifest":null,"mode":"trial balance","narration":null,"note":null,"notice":"◆ agent: opened Ledger · scope hold · caption “Brackenridge fee receivable, 2025 · 3 lines · 4,670.51” · ` back","overlay":null,"palette":null,"profile":"demo","prompt":null,"record":{"chain_seq":274,"classify_rev":82,"derivation":1},"recording":null,"result":null,"rev":1,"rows":[{"anchor":{"account_code":"1010","account_id":"h-res","org":"hold"},"fields":{"account":"Brackenridge Reserve Account","balance":"16109.61","balance_value":16109.61,"class":"ASSET","code":"1010","credit":"","credit_value":null,"debit":"16,109.61","debit_value":16109.61,"differs":false,"flag":""},"row":1,"selected":true},{"anchor":{"account_code":"1460","account_id":"h-1460","org":"hold"},"fields":{"account":"Term Loan to Tallowmere","balance":"15568.80","balance_value":15568.80,"class":"ASSET","code":"1460","credit":"","credit_value":null,"debit":"15,568.80","debit_value":15568.80,"differs":false,"flag":""},"row":2,"selected":false},{"anchor":{"account_code":"1470","account_id":"h-1470","org":"hold"},"fields":{"account":"Fees Receivable from Quillfeather","balance":"4670.51","balance_value":4670.51,"class":"ASSET","code":"1470","credit":"","credit_value":null,"debit":"4,670.51","debit_value":4670.51,"differs":false,"flag":""},"row":3,"selected":false},{"anchor":{"account_code":"1480","account_id":"h-1480","org":"hold"},"fields":{"account":"Equipment Advance to Saltmarsh","balance":"6912.48","balance_value":6912.48,"class":"ASSET","code":"1480","credit":"","credit_value":null,"debit":"6,912.48","debit_value":6912.48,"differs":false,"flag":""},"row":4,"selected":false},{"anchor":{"account_code":"3010","account_id":"h-3010","org":"hold"},"fields":{"account":"Brackenridge Ordinary Shares","balance":"-36742.18","balance_value":-36742.18,"class":"EQUITY","code":"3010","credit":"36,742.18","credit_value":36742.18,"debit":"","debit_value":null,"differs":false,"flag":""},"row":5,"selected":false},{"anchor":{"account_code":"3200","account_id":"h-3200","org":"hold"},"fields":{"account":"Retained Earnings","balance":"-1906.33","balance_value":-1906.33,"class":"EQUITY","code":"3200","credit":"1,906.33","credit_value":1906.33,"debit":"","debit_value":null,"differs":false,"flag":""},"row":6,"selected":false},{"anchor":{"account_code":"4610","account_id":"h-4610","org":"hold"},"fields":{"account":"Group Management Fee Income","balance":"-5528.36","balance_value":-5528.36,"class":"REVENUE","code":"4610","credit":"5,528.36","credit_value":5528.36,"debit":"","debit_value":null,"differs":false,"flag":""},"row":7,"selected":false},{"anchor":{"account_code":"4710","account_id":"h-4710","org":"hold"},"fields":{"account":"Intra-group Interest Income","balance":"-412.37","balance_value":-412.37,"class":"REVENUE","code":"4710","credit":"412.37","credit_value":412.37,"debit":"","debit_value":null,"differs":false,"flag":""},"row":8,"selected":false},{"anchor":{"account_code":"6050","account_id":"h-6050","org":"hold"},"fields":{"account":"Board & Audit Fees","balance":"1327.84","balance_value":1327.84,"class":"EXPENSE","code":"6050","credit":"","credit_value":null,"debit":"1,327.84","debit_value":1327.84,"differs":false,"flag":""},"row":9,"selected":false}],"running":null,"scope":"hold","selected":{"account_code":"1010","account_id":"h-res","org":"hold"},"selected_label":"1010 Brackenridge Reserve Account","size":{"cols":100,"rows":30},"sort":null,"strip":{"calls_left":978,"calls_left_estimated":false,"calls_level":"ok","calls_limit":1000,"matches_xero":true,"record_age":"record 07:46 UTC · 2h ago","record_level":"ok"},"tab":"ledger","theme":{"color":"color","glyphs":"unicode","knobs":{"breadcrumb":"0.00","compare_columns":"0.00","header_band":"0.06","header_gradient":false,"pair_band":"neutral","proposed_rows":"0.06","section_band":"0.00","selection":"0.04","status_err":"0.00","status_warn":"0.00"},"name":"ledger-light","overlay":{"tokens":{}},"revision":null},"truncated":false,"update_available":null,"v":1,"version":"0.0.0-test","view":{"first_visible":1,"last_visible":9,"total_rows":9},"walkthrough":null}
